id,subreddit,title,selftext,comments,top_comments,score,num_comments,upvote_ratio,flair,created_utc
1lic9so,Showerthoughts,"When you wake up to roll over in bed, it's like changing the channels on the dreams you're having.",,"[""The moderators have reflaired this post as a **casual thought**.\n\nCasual thoughts should be presented well, but are not required to be unique or exceptional.\n\nPlease review [each flair's requirements](https://www.reddit.com/r/Showerthoughts/wiki/requirements) for more information.\n\n&nbsp;\n\n^^This ^^is ^^an ^^automated ^^system.\n\n^^If ^^you ^^have ^^any ^^questions, ^^please [^^use ^^this ^^link](https://www.reddit.com/message/compose/?to=/r/Showerthoughts&subject=Question%20About%20This%20Post&message=I%20have%20a%20question%20regarding%20a%20recent%20post.I%20understand%20that%20I%20may%20be%20banned%20if%20my%20question%20has%20already%20been%20addressed%20by%20the%20rules.) ^^to ^^message ^^the ^^moderators."", 'And the fart is the static between channels...', 'but what if your sleeping and in your dream you get get pushed down a hill and your rolling down so your body also rolls over to another side, like how u see a toilet in a dream and u go to it but when you wake up you see theres a pile of piss on your pants and bed.', 'It’s wild to think your bed is like a dream remote—and rolling over is literally hitting “next channel” on your subconscious TV.', ""I have a theory on that, which i have ZERO proof of other than my own experience and literally nothing else. \n\nI think when we lay on our sides depending which side you are lying on something in your brain also shifts. Maybe it's the fluid in your brain, maybe its some underlying thing I have 0 concept of.\n\nBut I've noticed that when I lay on my right side dreams and thoughts tend to be more colorful, and imaginative but with less logic, if I flip sides the color and imaginative goes away and things become more logical.\n\nIf I couldn't repeat this literally every night I would say it's just me, but it works....every time. Like clockwork"", 'Then I believe I just doom scroll through all the channels with the many times I keep rolling.', 'Reply: Meanwhile, my brain always seems to switch to the nightmares channel!', ""And when you have sleep apnea, it's like changing the channels every few minutes because nothing's on"", 'Except when I roll over and the dream ends and now I’m just lying there questioning reality and whether I remembered to pay my car insurance.', ""Do you wake up to roll over, or do you roll over just because you've woken up???""]","['And the fart is the static between channels...', 'but what if your sleeping and in your dream you get get pushed down a hill and your rolling down so your body also rolls over to another side, like how u see a toilet in a dream and u go to it but when you wake up you see theres a pile of piss on your pants and bed.', ""I have a theory on that, which i have ZERO proof of other than my own experience and literally nothing else. \n\nI think when we lay on our sides depending which side you are lying on something in your brain also shifts. Maybe it's the fluid in your brain, maybe its some underlying thing I have 0 concept of.\n\nBut I've noticed that when I lay on my right side dreams and thoughts tend to be more colorful, and imaginative but with less logic, if I flip sides the color and imaginative goes away and things become more logical.\n\nIf I couldn't repeat this literally every night I would say it's just me, but it works....every time. Like clockwork"", 'It’s wild to think your bed is like a dream remote—and rolling over is literally hitting “next channel” on your subconscious TV.', 'Then I believe I just doom scroll through all the channels with the many times I keep rolling.']",2519,49,0.97,Casual Thought,1750671334.0
1lglox9,Showerthoughts,It’s weird how TV episodes usually have names but TV seasons never do.,,"['/u/karmagirl314 has flaired this post as a **casual thought**.\n\nCasual thoughts should be presented well, but may be less unique or less remarkable than [showerthoughts](https://www.reddit.com/r/Showerthoughts/wiki/requirements).\n\nIf this post is poorly written, unoriginal, or rule-breaking, please report it.\n\nOtherwise, please add your comment to the discussion!\n\n&nbsp;\n\n^^This ^^is ^^an ^^automated ^^system.\n\n^^If ^^you ^^have ^^any ^^questions, ^^please [^^use ^^this ^^link](https://www.reddit.com/message/compose/?to=/r/Showerthoughts&subject=Question%20About%20This%20Post&message=I%20have%20a%20question%20regarding%20a%20recent%20post.I%20understand%20that%20I%20may%20be%20banned%20if%20my%20question%20has%20already%20been%20addressed%20by%20the%20rules.) ^^to ^^message ^^the ^^moderators.', 'Depends on the show. \n\nCommunity has the gas leak season', 'Never say never.\n\nBabylon 5 (1994-98) each of the five seasons has a name', 'Avatar stands out with the 3 books, water, earth, fire.', 'LEGO Ninjago has a name for every season:\n\n1. Rise of the Serpentine\n2. Legacy of the Green Ninja\n3. Rebooted\n4. The Tournament of Elements\n5. Possession\n6. Skybound\n\nThat’s about when I stopped watching but I think the show is still going so I’m sure they have many more season titles.', 'TV seasons sometimes do have names.  American Horror Story names every season (Season 1 is ""Murder House"", and so on).  The 4th True Detective was named Night Country.  Survivor seasons are usually named after the location.  There\'s a few others.', 'They occasionally have names. Series 3 and 4 of Torchwood and Series 13 of the Doctor Who reboot had names.', 'Season 2 of Atlanta was subtitled “Robbin’ Season”.', 'Archer the cartoon had several different season names.', 'Power Rangers started doing that once they started changing suits and theme every year.']","['Depends on the show. \n\nCommunity has the gas leak season', 'Avatar stands out with the 3 books, water, earth, fire.', 'TV seasons sometimes do have names.  American Horror Story names every season (Season 1 is ""Murder House"", and so on).  The 4th True Detective was named Night Country.  Survivor seasons are usually named after the location.  There\'s a few others.', 'Never say never.\n\nBabylon 5 (1994-98) each of the five seasons has a name', 'LEGO Ninjago has a name for every season:\n\n1. Rise of the Serpentine\n2. Legacy of the Green Ninja\n3. Rebooted\n4. The Tournament of Elements\n5. Possession\n6. Skybound\n\nThat’s about when I stopped watching but I think the show is still going so I’m sure they have many more season titles.']",9401,368,0.96,Casual Thought,1750472572.0
1lgijir,Showerthoughts,Everyone should have to experience a simulation of what going through a crash on the highways feels like before they get a license.,,"['/u/carinislumpyhead97 has flaired this post as a **casual thought**.\n\nCasual thoughts should be presented well, but may be less unique or less remarkable than [showerthoughts](https://www.reddit.com/r/Showerthoughts/wiki/requirements).\n\nIf this post is poorly written, unoriginal, or rule-breaking, please report it.\n\nOtherwise, please add your comment to the discussion!\n\n&nbsp;\n\n^^This ^^is ^^an ^^automated ^^system.\n\n^^If ^^you ^^have ^^any ^^questions, ^^please [^^use ^^this ^^link](https://www.reddit.com/message/compose/?to=/r/Showerthoughts&subject=Question%20About%20This%20Post&message=I%20have%20a%20question%20regarding%20a%20recent%20post.I%20understand%20that%20I%20may%20be%20banned%20if%20my%20question%20has%20already%20been%20addressed%20by%20the%20rules.) ^^to ^^message ^^the ^^moderators.', 'I saw a ""seat belt convincer"" the other day that simulated a wreck at 45 MPH I think. It was interesting to see people try it, but I definitely wasnt one of them.', 'That would probably make transit more popular.', ""is there a subset of new drivers that think getting into an accident is a pleasant thing?\n\nif not,  i'm just wondering that actionable lessons could be learned from it.\n\nflight simulators are all about avoiding a crash.    they take greats pains and expense to make the experience feel real both in visuals and the physics of moving the simulator.    but they don't do much at all to simulate the crash other than a noise and visual cracked screen.   Space craft simulators the same.\n\nin surprised we don't do more with driving simulators.     i think they could use useful.\n\nwe had them in the 80s in high school drivers ed.   they were vastly out of date though and even by 80s tech standards felt clunky.    Once those were retired there wasn't a second generation of them for reasons i don't know."", 'I’d rather everyone have to work a retail/customer service job for a year.\n\nKnowing what a car accident feels like isn’t going to get people to pay more attention or drive better. It’s the cars/motorcycles/pedestrians you don’t see that are the ones you collide with. \n\nBut, everyone getting the customer service treatment for a year would def change how many of those interactions go, period.', 'Like, have your back broken or your ribs or something?', 'The duration of time watching “red asphalt” during my drivers ed was about half the time of drivers ed. For 6 days straight at 9 hours a day during Christmas break. \n\nYeah, trying to get your drivers permit in California before you’re 18 was a bit of work.', 'My experience of people that have been in bad accidents is that they are more nervous and worse drivers.', 'Fuck the simulation, make them joust golf carts.', ""Kinda like the requirement to get tasered before you can own a taser.\n\nIs that true, or is it just a urban legend? I've never considered getting a taser.\n\nI mean, imagine if they had something similar for actual firearms.\n\nI guess they could put your hand in a box of fire ants or something. Now *that* would be gun control.""]","['That would probably make transit more popular.', 'I saw a ""seat belt convincer"" the other day that simulated a wreck at 45 MPH I think. It was interesting to see people try it, but I definitely wasnt one of them.', ""is there a subset of new drivers that think getting into an accident is a pleasant thing?\n\nif not,  i'm just wondering that actionable lessons could be learned from it.\n\nflight simulators are all about avoiding a crash.    they take greats pains and expense to make the experience feel real both in visuals and the physics of moving the simulator.    but they don't do much at all to simulate the crash other than a noise and visual cracked screen.   Space craft simulators the same.\n\nin surprised we don't do more with driving simulators.     i think they could use useful.\n\nwe had them in the 80s in high school drivers ed.   they were vastly out of date though and even by 80s tech standards felt clunky.    Once those were retired there wasn't a second generation of them for reasons i don't know."", 'I’d rather everyone have to work a retail/customer service job for a year.\n\nKnowing what a car accident feels like isn’t going to get people to pay more attention or drive better. It’s the cars/motorcycles/pedestrians you don’t see that are the ones you collide with. \n\nBut, everyone getting the customer service treatment for a year would def change how many of those interactions go, period.', 'Being too safe on the roads is also dangerous, you need to be confident in your abilities and not overly second guess all your decisions- if you’re constantly on edge and anticipating a crash then you’re not thinking clearly\n\nAlso not everyone is neurotypical, doing this to people with ptsd for example is a horrible idea']",4324,231,0.96,Casual Thought,1750462888.0
1lg9v9n,Showerthoughts,Front lawns are mostly just for show.,,"['/u/QuantumDreamer41 has flaired this post as a **casual thought**.\n\nCasual thoughts should be presented well, but may be less unique or less remarkable than [showerthoughts](https://www.reddit.com/r/Showerthoughts/wiki/requirements).\n\nIf this post is poorly written, unoriginal, or rule-breaking, please report it.\n\nOtherwise, please add your comment to the discussion!\n\n&nbsp;\n\n^^This ^^is ^^an ^^automated ^^system.\n\n^^If ^^you ^^have ^^any ^^questions, ^^please [^^use ^^this ^^link](https://www.reddit.com/message/compose/?to=/r/Showerthoughts&subject=Question%20About%20This%20Post&message=I%20have%20a%20question%20regarding%20a%20recent%20post.I%20understand%20that%20I%20may%20be%20banned%20if%20my%20question%20has%20already%20been%20addressed%20by%20the%20rules.) ^^to ^^message ^^the ^^moderators.', ""got a neighbor that lives in their front yard during the summer- lots of chairs, toys and bikes strewn about it the moment its above 70 till it ain't."", ""Yes - that's why I filled my with native grasses and wildflowers."", 'I think historically lawns in general are just for show. \n\nIt was seen as a sign of affluence that you could have arable land and use it just for decorative purposes, and more so that it needed maintaining on a regular basis in times with only manual tools. \n\nhttps://simple.m.wikipedia.org/wiki/Lawn', 'It’s where I place my plants for when the zombies attack.', '[deleted]', 'I use mine for watching nature and my kids use it to play', ""I won't have you talking about my grass moat like that. It's purely for defensive measures, any pleasant aesthetics are simply a coincidence and not hidden traps."", 'space from the street and a green view as well. It sucks having a street outside your window', 'I think this is probably highly dependent upon where you live, lot size, the age of the people in the house, and pets.\n\nI live in the city on a tiny lot. We have more usable front yard than back, kids, and no pets. Both yards are used a lot.']","[""Yes - that's why I filled my with native grasses and wildflowers."", ""got a neighbor that lives in their front yard during the summer- lots of chairs, toys and bikes strewn about it the moment its above 70 till it ain't."", 'I think historically lawns in general are just for show. \n\nIt was seen as a sign of affluence that you could have arable land and use it just for decorative purposes, and more so that it needed maintaining on a regular basis in times with only manual tools. \n\nhttps://simple.m.wikipedia.org/wiki/Lawn', '[deleted]', 'I use mine for watching nature and my kids use it to play']",1766,157,0.94,Casual Thought,1750440577.0
1lfgop2,Showerthoughts,If your life flashed before your eyes it would look like a strobe light because of how much you sleep.,,"['/u/LavenderLemon_203 has flaired this post as a **casual thought**.\n\nCasual thoughts should be presented well, but may be less unique or less remarkable than [showerthoughts](https://www.reddit.com/r/Showerthoughts/wiki/requirements).\n\nIf this post is poorly written, unoriginal, or rule-breaking, please report it.\n\nOtherwise, please add your comment to the discussion!\n\n&nbsp;\n\n^^This ^^is ^^an ^^automated ^^system.\n\n^^If ^^you ^^have ^^any ^^questions, ^^please [^^use ^^this ^^link](https://www.reddit.com/message/compose/?to=/r/Showerthoughts&subject=Question%20About%20This%20Post&message=I%20have%20a%20question%20regarding%20a%20recent%20post.I%20understand%20that%20I%20may%20be%20banned%20if%20my%20question%20has%20already%20been%20addressed%20by%20the%20rules.) ^^to ^^message ^^the ^^moderators.', 'Unless your dreams are part of the flashback, in which case it would be flickering between fact and fiction.', 'Interestingly, the opposite is true. When the first black and white films were made with 25 pictures per second the films flickered. Once they inserted black squares between each picture of the movie shots films became much more fluid.', ""Well shit, as someone with epilepsy I'd definitely die after that."", 'Ahhh yes a nice relaxing strobe light as I go out.', 'yeah, because you consciously experience and record the 8 hours a night when your eyes see blackness', 'Ah, the strobe light of life! Blink and you miss the Sunday roast burning while you’re napping through the football high!', 'Joke’s on you — my life would look like a loading screen with bad Wi-Fi.', 'Pretty sure I experienced this when I got too high once', ""Great... I'm getting nauseous just thinking about it.""]","['Unless your dreams are part of the flashback, in which case it would be flickering between fact and fiction.', 'Interestingly, the opposite is true. When the first black and white films were made with 25 pictures per second the films flickered. Once they inserted black squares between each picture of the movie shots films became much more fluid.', 'Ahhh yes a nice relaxing strobe light as I go out.', ""Well shit, as someone with epilepsy I'd definitely die after that."", 'yeah, because you consciously experience and record the 8 hours a night when your eyes see blackness']",2931,37,0.98,Casual Thought,1750354113.0
1lfg63h,Showerthoughts,Testicles can turn a man on and off depending on how hard they’re touched.,,"['/u/NuttyMcShithead has flaired this post as a **casual thought**.\n\nCasual thoughts should be presented well, but may be less unique or less remarkable than [showerthoughts](https://www.reddit.com/r/Showerthoughts/wiki/requirements).\n\nIf this post is poorly written, unoriginal, or rule-breaking, please report it.\n\n Otherwise, please add your comment to the discussion!\n\n&nbsp;\n\n^^This ^^is ^^an ^^automated ^^system.\n\n^^If ^^you ^^have ^^any ^^questions, ^^please [^^use ^^this ^^link](https://www.reddit.com/message/compose/?to=/r/Showerthoughts&subject=Question%20About%20This%20Post&message=I%20have%20a%20question%20regarding%20a%20recent%20post.I%20understand%20that%20I%20may%20be%20banned%20if%20my%20question%20has%20already%20been%20addressed%20by%20the%20rules.) ^^to ^^message ^^the ^^moderators.', 'Any part of the body can fall under those rules my guy.', 'Testicles can turn a man on or off depending on if he is gay or not', 'Yeah they\'re the on/off switch. If you hold them and lift that\'s the ""on"" position and if you pull them that\'s the ""off"".', ""Help my boyfriend isn't working right.\n\nHave you tried turning him off and on again"", 'Freshman year of college my dorm did a thing where they hung a sheet and put girls on one side and guys on the other so they could “anonymously” ask questions. In response to a question of how to deal with testicles some dude said “grab em and squeeze them”. I felt it was my duty to say “not everyone likes that. I’d prefer you didn’t touch em at all”. I have a distinct voice. Hundreds of people knew my ball squeezing preference from that day on', ""As always, 'it depends,' most usually, it's a pretty subjective experience. But assuming a generally negative reaction to getting clocked, in a bad way.....\n\nHere's a corollary I've learned over the years- if you get hard enough, past a certain pain threshold, it hurts LESS than a glancing-but-solid swipe across the sack. If hit bad enough, I just shut down into anasthetic shock. It's the accidental hot that curls me fetal for an hour.\n\nI can't be the only one, can I?"", 'How hard should they be touched? Asking for a friend...', 'I can go from flaccid to erect in a moment’s notice. Buddy, you’re seein’ it. You’re all seein’ it. Flaccid, erect. Flaccid, erect. Flaccid, erect. Not too hard, not too soft.', ""\nI don't believe you have a baĺlsack, op. Because getting it squeezed and twisted, ever so softly, is not an erotic experience.""]","['Any part of the body can fall under those rules my guy.', 'Yeah they\'re the on/off switch. If you hold them and lift that\'s the ""on"" position and if you pull them that\'s the ""off"".', 'Testicles can turn a man on or off depending on if he is gay or not', ""Help my boyfriend isn't working right.\n\nHave you tried turning him off and on again"", 'Freshman year of college my dorm did a thing where they hung a sheet and put girls on one side and guys on the other so they could “anonymously” ask questions. In response to a question of how to deal with testicles some dude said “grab em and squeeze them”. I felt it was my duty to say “not everyone likes that. I’d prefer you didn’t touch em at all”. I have a distinct voice. Hundreds of people knew my ball squeezing preference from that day on']",1271,75,0.91,Casual Thought,1750352908.0
1lff47l,Showerthoughts,Every glass of water you drink carries an avalanche of molecules that once sloshed through a dinosaur.,,"['/u/dabears4hss has flaired this post as a **casual thought**.\n\nCasual thoughts should be presented well, but may be less unique or less remarkable than [showerthoughts](https://www.reddit.com/r/Showerthoughts/wiki/requirements).\n\nIf this post is poorly written, unoriginal, or rule-breaking, please report it.\n\nOtherwise, please add your comment to the discussion!\n\n&nbsp;\n\n^^This ^^is ^^an ^^automated ^^system.\n\n^^If ^^you ^^have ^^any ^^questions, ^^please [^^use ^^this ^^link](https://www.reddit.com/message/compose/?to=/r/Showerthoughts&subject=Question%20About%20This%20Post&message=I%20have%20a%20question%20regarding%20a%20recent%20post.I%20understand%20that%20I%20may%20be%20banned%20if%20my%20question%20has%20already%20been%20addressed%20by%20the%20rules.) ^^to ^^message ^^the ^^moderators.', 'The food you eat has probably been inside animal excrement at some point', 'This is not true and I have no idea why this nonsense keeps getting regurgitated.  Water molecules are constantly getting created and destroyed most commonly through photosynthesis and cellular respiration .  Every animal, every plankton in the ocean, every tree cell, every bacteria, is constantly creating new water molecules and destroying old ones.', 'And every glass they drank came from a fish or trilobite or something', 'So a filter is essentially removing the dinosaurs.', 'Every fart you smell has been festering in someone’s rectum.', '[removed]', 'I hear this said a lot online. Is it really fair to assume that all fresh water has been previously drank by a dinosaur? I’d like to think it but I just can’t imagine that’s true', 'The life of a water molecule is not so simple. Water molecules are not really static things. The two hydrogens can move to other oxygens. The oxygens can get inserted into sugars or proteins or carbon dioxide.', 'Let me tell you about what happens when I eat a chicken…']","['The food you eat has probably been inside animal excrement at some point', 'This is not true and I have no idea why this nonsense keeps getting regurgitated.  Water molecules are constantly getting created and destroyed most commonly through photosynthesis and cellular respiration .  Every animal, every plankton in the ocean, every tree cell, every bacteria, is constantly creating new water molecules and destroying old ones.', 'And every glass they drank came from a fish or trilobite or something', 'So a filter is essentially removing the dinosaurs.', 'Every fart you smell has been festering in someone’s rectum.']",997,73,0.92,Casual Thought,1750350401.0
1lfddf3,Showerthoughts,"Statistically speaking, the most common final words men across history have heard before dying are probably ""I love you"" or ""Fire"".",,"['/u/poliguy25 has flaired this post as a **speculation**.\n\nSpeculations should prompt people to consider interesting premises that cannot be reliably verified or falsified.\n\nIf this post is poorly written, unoriginal, or rule-breaking, please report it.\n\nOtherwise, please add your comment to the discussion!\n\n&nbsp;\n\n^^This ^^is ^^an ^^automated ^^system.\n\n^^If ^^you ^^have ^^any ^^questions, ^^please [^^use ^^this ^^link](https://www.reddit.com/message/compose/?to=/r/Showerthoughts&subject=Question%20About%20This%20Post&message=I%20have%20a%20question%20regarding%20a%20recent%20post.I%20understand%20that%20I%20may%20be%20banned%20if%20my%20question%20has%20already%20been%20addressed%20by%20the%20rules.) ^^to ^^message ^^the ^^moderators.', 'And here I am thinking it’s “Aaaaaaahhhhhhhh!!!!”', 'Watch out.  Oh shit.  Fuck.  Guessing all of these and their other language equivalents rate higher.', 'Lots of flight data recorders had ""sh\\*t"" as the pilot\'s final words.', 'I\'d say it\'d be ""Help"" ""It hurts"" ""I\'m scared"" or screaming most probably', '\nWhat about, ""hey guys, watch this"" or ""hold my beer""', 'You can\'t say ""statically speaking"" and ""probably"" in the same sentence.  A shower thought is either a ponderance of a fact or a speculative observation; not both.', 'Statistically speaking, no lol \n \nHearing ""Fire"" before dying would only make sense if you die by firearm. Firearms usage in war only represents a fraction of human history. \n \nI have no statistics to back this up, but I would even wager that the majority of men in history did not die in a war ...', '”Statistically speaking” may sounds smart but actually makes everything that follows sound even more dumb.', 'What do you mean by fire? Like death by a firing squad? How common do you think that was? How much of human history do you think has had access to guns?']","['And here I am thinking it’s “Aaaaaaahhhhhhhh!!!!”', 'Watch out.  Oh shit.  Fuck.  Guessing all of these and their other language equivalents rate higher.', 'I\'d say it\'d be ""Help"" ""It hurts"" ""I\'m scared"" or screaming most probably', '\nWhat about, ""hey guys, watch this"" or ""hold my beer""', 'Statistically speaking, no lol \n \nHearing ""Fire"" before dying would only make sense if you die by firearm. Firearms usage in war only represents a fraction of human history. \n \nI have no statistics to back this up, but I would even wager that the majority of men in history did not die in a war ...']",10604,500,0.9,Speculation,1750346171.0
