id,subreddit,title,selftext,comments,top_comments,score,num_comments,upvote_ratio,flair,created_utc
1l9ut3g,Showerthoughts,"People are often hesitant to spend more money than necessary, but won’t think twice about procrastinating their time away.",,"['/u/IlJustAReminderIl has flaired this post as a **musing**.\n\nMusings are expected to be high-quality and thought-provoking, but not necessarily as unique as [showerthoughts](https://www.reddit.com/r/Showerthoughts/wiki/requirements).\n\nIf this post is poorly written, unoriginal, or rule-breaking, please report it.\n\nOtherwise, please add your comment to the discussion!\n\n&nbsp;\n\n^^This ^^is ^^an ^^automated ^^system.\n\n^^If ^^you ^^have ^^any ^^questions, ^^please [^^use ^^this ^^link](https://www.reddit.com/message/compose/?to=/r/Showerthoughts&subject=Question%20About%20This%20Post&message=I%20have%20a%20question%20regarding%20a%20recent%20post.I%20understand%20that%20I%20may%20be%20banned%20if%20my%20question%20has%20already%20been%20addressed%20by%20the%20rules.) ^^to ^^message ^^the ^^moderators.', 'The time spent doing nothing is the sweetest time.', ""My time will last for as long as I live\n\nMy money will run out if I'm not picky about how it's spent"", 'The only reason I am carefully managing my money is to be able to afford to spend a lot of time doing nothing. Checkmate to your thought.', ""False. If you're procrastinating you KNOW it. It is a conscious decision and every moment is spent thinking about what you're supposed to be doing and then ignoring that thought."", ""Who'd have thought that people prefer to spend their limited time happy"", 'I even sometimes spend money while I’m procrastinating.', 'Not always true. Those of us with executive dysfunction think constantly about our procrastination and are generally distraught because we can’t get up and do the thing we need to do.', ""Well when i procrastinate, it's usually doing what i actually want to do"", 'My time might be finite, but I have enough to last me until I die.\n\nMoney on the other hand...']","['The time spent doing nothing is the sweetest time.', ""My time will last for as long as I live\n\nMy money will run out if I'm not picky about how it's spent"", 'The only reason I am carefully managing my money is to be able to afford to spend a lot of time doing nothing. Checkmate to your thought.', ""False. If you're procrastinating you KNOW it. It is a conscious decision and every moment is spent thinking about what you're supposed to be doing and then ignoring that thought."", ""Who'd have thought that people prefer to spend their limited time happy""]",849,50,0.94,Musing,1749754848.0
1l9ujmb,Showerthoughts,The price for seat 11A on every flight is going to be higher from now on.,,"['/u/Sanjuro7880 has flaired this post as a **speculation**.\n\nSpeculations should prompt people to consider interesting premises that cannot be reliably verified or falsified.\n\nIf this post is poorly written, unoriginal, or rule-breaking, please report it.\n\nOtherwise, please add your comment to the discussion!\n\n&nbsp;\n\n^^This ^^is ^^an ^^automated ^^system.\n\n^^If ^^you ^^have ^^any ^^questions, ^^please [^^use ^^this ^^link](https://www.reddit.com/message/compose/?to=/r/Showerthoughts&subject=Question%20About%20This%20Post&message=I%20have%20a%20question%20regarding%20a%20recent%20post.I%20understand%20that%20I%20may%20be%20banned%20if%20my%20question%20has%20already%20been%20addressed%20by%20the%20rules.) ^^to ^^message ^^the ^^moderators.', ""On Ryanair 11a doesn't even have a window it's just a wall imagine being upcharged to have a wall seat"", 'Idk man, I feel like choosing that seat is kinda like betting on the number that just hit in roulette', ""I was on 11A but on a A320 or A321. It's already more expensive because emergency exit. Sooooo please, no :D"", 'Just make sure you have your tray table up, and your seatback in the full upright position.', 'Airlines will start charging ""extra super premium"" upgrade fees for seat 11A from now on.', ""Yep, as long as you're on the exact same model of plane and it crashes in the exact same manner in the exact same location with the exact same conditions with the exact same load of passengers and cargo, you're set!"", 'Is this to do with the Indian crash? Was 11A the sole survivor or something? I don’t really look into the news.', 'Seat 11A used up all its luck as far as I’m concerned. I want nothing to do with it', 'After the Delta L-1011 crash at Dallas-Fort Worth Airport in 1985, I remember people joking about taking up smoking. Nearly all of the least-injured or uninjured survivors were in the smoking section in the tail.']","[""On Ryanair 11a doesn't even have a window it's just a wall imagine being upcharged to have a wall seat"", ""Yep, as long as you're on the exact same model of plane and it crashes in the exact same manner in the exact same location with the exact same conditions with the exact same load of passengers and cargo, you're set!"", 'Airlines will start charging ""extra super premium"" upgrade fees for seat 11A from now on.', ""I was on 11A but on a A320 or A321. It's already more expensive because emergency exit. Sooooo please, no :D"", 'Idk man, I feel like choosing that seat is kinda like betting on the number that just hit in roulette']",12614,272,0.92,Speculation,1749754228.0
1l9ui1u,Showerthoughts,"Time doesn't heal all wounds, it just teaches you how to live around them.",,"['/u/SmellyCat0007 has flaired this post as a **musing**.\n\nMusings are expected to be high-quality and thought-provoking, but not necessarily as unique as [showerthoughts](https://www.reddit.com/r/Showerthoughts/wiki/requirements).\n\nIf this post is poorly written, unoriginal, or rule-breaking, please report it.\n\nOtherwise, please add your comment to the discussion!\n\n&nbsp;\n\n^^This ^^is ^^an ^^automated ^^system.\n\n^^If ^^you ^^have ^^any ^^questions, ^^please [^^use ^^this ^^link](https://www.reddit.com/message/compose/?to=/r/Showerthoughts&subject=Question%20About%20This%20Post&message=I%20have%20a%20question%20regarding%20a%20recent%20post.I%20understand%20that%20I%20may%20be%20banned%20if%20my%20question%20has%20already%20been%20addressed%20by%20the%20rules.) ^^to ^^message ^^the ^^moderators.', 'Best comment i heard after my mom passed was ""it doesnt get better but it does get easier"". It actually went a long way to help me not feel guilty try to move forward because it wont ever be ok that my mom missed so much but that doesnt mean i need to be raw and in pain about it all the time either.', 'On a long enough timeline, all memories fade.', 'Eh idk. When a wound heals it leaves a scar right?  The expression isn’t saying “time makes everything the way it was before” \n\nIt’s saying “time will teach you how to cope, learn, and move on from the trauma”', 'With *literal* wounds, this is true too.  Your body figures out how to live despite the damaged tissues.', ""My lady died of suicide in 1986, it's downhill for 20+ years, hit bottom and then try to move on. I was 30 at the time."", ""It's not time.  It's the therapy and work that heals your wounds. The epoxy of your broken life. \n\nTime is letting that epoxy set."", ""It's not time. It's the therapy and work that heals your wounds"", 'Very true. My friend died in 2023 but the pain of it all still feels like yesterday when I think about it. People say everything happens for a reason but nothing could ever justify removing her from this world to me.', '[deleted]']","['Best comment i heard after my mom passed was ""it doesnt get better but it does get easier"". It actually went a long way to help me not feel guilty try to move forward because it wont ever be ok that my mom missed so much but that doesnt mean i need to be raw and in pain about it all the time either.', 'On a long enough timeline, all memories fade.', 'With *literal* wounds, this is true too.  Your body figures out how to live despite the damaged tissues.', 'Eh idk. When a wound heals it leaves a scar right?  The expression isn’t saying “time makes everything the way it was before” \n\nIt’s saying “time will teach you how to cope, learn, and move on from the trauma”', ""It's not time.  It's the therapy and work that heals your wounds. The epoxy of your broken life. \n\nTime is letting that epoxy set.""]",977,51,0.97,Musing,1749754131.0
1l9qhlc,Showerthoughts,"Regardless how popular other super heroes are, Superman has been referenced the most in mainstream songs.",,"['/u/kioshi43 has flaired this post as a **casual thought**.\n\nCasual thoughts should be presented well, but may be less unique or less remarkable than [showerthoughts](https://www.reddit.com/r/Showerthoughts/wiki/requirements).\n\nIf this post is poorly written, unoriginal, or rule-breaking, please report it.\n\nOtherwise, please add your comment to the discussion!\n\n&nbsp;\n\n^^This ^^is ^^an ^^automated ^^system.\n\n^^If ^^you ^^have ^^any ^^questions, ^^please [^^use ^^this ^^link](https://www.reddit.com/message/compose/?to=/r/Showerthoughts&subject=Question%20About%20This%20Post&message=I%20have%20a%20question%20regarding%20a%20recent%20post.I%20understand%20that%20I%20may%20be%20banned%20if%20my%20question%20has%20already%20been%20addressed%20by%20the%20rules.) ^^to ^^message ^^the ^^moderators.', 'You might be interested in reading about the origin of the term ""superman"", you\'ll discover that not all references in pop culture are of the comic book character.', ""Ant Man just doesn't have the same ring to it"", '""If I go crazy then will you still call me Iceman"" doesn\'t hit the same', 'When’s the last time y’all heard the phrase, truth justice and the American way\xa0', 'Superman was the first superhero. I\'m pretty sure the ""super"" in ""superhero"" comes from him.', '""I whooped Batman\'s ass, I whooped Batman\'s ass.""', ""I can't do this all on my own, no I'm no Superman."", ""Supe _does_ have a shout out in Rapper's Delight."", 'I’m pretty sure Batman is more popular in the last couple of decades']","['You might be interested in reading about the origin of the term ""superman"", you\'ll discover that not all references in pop culture are of the comic book character.', 'Superman was the first superhero. I\'m pretty sure the ""super"" in ""superhero"" comes from him.', 'When’s the last time y’all heard the phrase, truth justice and the American way\xa0', ""Ant Man just doesn't have the same ring to it"", '""If I go crazy then will you still call me Iceman"" doesn\'t hit the same']",1256,90,0.96,Casual Thought,1749744800.0
1l98wzb,Showerthoughts,Slugs would be one of the creepiest creatures on Earth if they were fast.,,"['/u/MrBublee_YT has flaired this post as a **casual thought**.\n\nCasual thoughts should be presented well, but may be less unique or less remarkable than [showerthoughts](https://www.reddit.com/r/Showerthoughts/wiki/requirements).\n\nIf this post is poorly written, unoriginal, or rule-breaking, please report it.\n\nOtherwise, please add your comment to the discussion!\n\n&nbsp;\n\n^^This ^^is ^^an ^^automated ^^system.\n\n^^If ^^you ^^have ^^any ^^questions, ^^please [^^use ^^this ^^link](https://www.reddit.com/message/compose/?to=/r/Showerthoughts&subject=Question%20About%20This%20Post&message=I%20have%20a%20question%20regarding%20a%20recent%20post.I%20understand%20that%20I%20may%20be%20banned%20if%20my%20question%20has%20already%20been%20addressed%20by%20the%20rules.) ^^to ^^message ^^the ^^moderators.', 'And if they could jump, like haul ass and make a 10ft vertical leap.', 'Sloths too, check [this](https://youtube.com/shorts/lXLx6LbeSAo?si=DQBoUDSt1Y74-jdf)[](https://youtube.com/shorts/lXLx6LbeSAo?si=DQBoUDSt1Y74-jdf) out\n\nImagine that being fast', ""If they were fast they wouldn't be creepy they would be speedy"", 'Slugs are already one of the creepiest creatures on earth.', 'They would also be really scary if they were immortal and killed you on touch.', 'You should watch the movie, “Night of the Creeps”', 'The writers and directors of the movie Slither were well aware of that.', 'Or large.  Or highly organized, human eating predators.', 'Ha ha! Just like the movie [Night of the Creeps](https://youtu.be/_PmPuYg6nqM?si=N4hOkqoDhFnrcB5-) from the 80’s. Fun fact: this is where Stranger Things got their intro credits and theme song from.']","['And if they could jump, like haul ass and make a 10ft vertical leap.', 'Sloths too, check [this](https://youtube.com/shorts/lXLx6LbeSAo?si=DQBoUDSt1Y74-jdf)[](https://youtube.com/shorts/lXLx6LbeSAo?si=DQBoUDSt1Y74-jdf) out\n\nImagine that being fast', ""If they were fast they wouldn't be creepy they would be speedy"", 'Slugs are already one of the creepiest creatures on earth.', 'They would also be really scary if they were immortal and killed you on touch.']",2266,83,0.99,Casual Thought,1749688449.0
1l973vu,Showerthoughts,"If reincarnation was real everyone would pick a super rich person as their easy-mode tutorial mission, and that is why they all act so crazy.",,"['/u/thuanjinkee has flaired this post as a **casual thought**.\n\nCasual thoughts should be presented well, but may be less unique or less remarkable than [showerthoughts](https://www.reddit.com/r/Showerthoughts/wiki/requirements).\n\nIf this post is poorly written, unoriginal, or rule-breaking, please report it.\n\nOtherwise, please add your comment to the discussion!\n\n&nbsp;\n\n^^This ^^is ^^an ^^automated ^^system.\n\n^^If ^^you ^^have ^^any ^^questions, ^^please [^^use ^^this ^^link](https://www.reddit.com/message/compose/?to=/r/Showerthoughts&subject=Question%20About%20This%20Post&message=I%20have%20a%20question%20regarding%20a%20recent%20post.I%20understand%20that%20I%20may%20be%20banned%20if%20my%20question%20has%20already%20been%20addressed%20by%20the%20rules.) ^^to ^^message ^^the ^^moderators.', 'If reincarnation is real it could also mean that there’s just one person cycling through over and over and over. Which would mean that all those assholes, they’re just you.', 'Cute idea. But I think having no one around you who will tell you No sufficiently explains why they get so weird. Like Roman emporers', ""Fortunately, reincarnation is governed by karma; you get reincarnated as whomever you most deserve to be.  You don't get to choose."", 'Assuming we get to pick and not pull from a lottery', ""Why do you think you could have a choice to pick? Obviously we couldn't even if only for this very reason."", 'Why do you think anyone would get a choice?', 'If reincarnation is real, I would rather be a suburban pet dog than a rich person.\xa0', ""Considering that for every human there are 60 billion nematodes, you'd probably come back as a nematode nearly every time."", ""Not all rich people act crazy. There are over 3000 billionaires around the world. You only hear about a few of the batshit crazy ones, most are smart enough to be discreet. Like you don't want to hire people to protect you everywhere you go or be a celebrity where everything you do is spread across social media. I know quite a few people who have hundreds of millions but by name would be unrecognizable. They are really down to earth people. Yeah they are probably selfish and don't need that much, but really, they are just thinking they are providing for the future generations not thinking their kids will turn into insufferable entitled douche bags like Trump and Elon who are second generation trustfund kids but old.""]","['If reincarnation is real it could also mean that there’s just one person cycling through over and over and over. Which would mean that all those assholes, they’re just you.', ""Fortunately, reincarnation is governed by karma; you get reincarnated as whomever you most deserve to be.  You don't get to choose."", 'Cute idea. But I think having no one around you who will tell you No sufficiently explains why they get so weird. Like Roman emporers', 'Assuming we get to pick and not pull from a lottery', ""Why do you think you could have a choice to pick? Obviously we couldn't even if only for this very reason.""]",6043,264,0.91,Casual Thought,1749683326.0
1l8zxst,Showerthoughts,"There's no way to verify the efficacy of quitting social media by asking people, because they are no longer here.",,"[""The moderators have reflaired this post as a **musing**.\n\nMusings are expected to be high-quality, original, and thought-provoking, but not necessarily unique.\n\nPlease review [each flair's requirements](https://www.reddit.com/r/Showerthoughts/wiki/requirements) for more information.\n\n&nbsp;\n\n^^This ^^is ^^an ^^automated ^^system.\n\n^^If ^^you ^^have ^^any ^^questions, ^^please [^^use ^^this ^^link](https://www.reddit.com/message/compose/?to=/r/Showerthoughts&subject=Question%20About%20This%20Post&message=I%20have%20a%20question%20regarding%20a%20recent%20post.I%20understand%20that%20I%20may%20be%20banned%20if%20my%20question%20has%20already%20been%20addressed%20by%20the%20rules.) ^^to ^^message ^^the ^^moderators."", 'If only there were some way to interact with people outside of social media. :(', 'You can talk to other people ouside of the internet you know its called real life.', ""Did you know that the people you talk to on the internet actually exist in real life? It's crazy but it's true."", ""People don't stop existing once they're off social media.  \nYou can still talk to them...!!"", 'Yes you would have to actually interact with them “IRL” as you people say.', 'Mind blown, if you quit, how do you even know it would’ve worked out if you’d kept going?', 'It’s like trying to interview monks about the benefits of silence — the ones who get it aren’t talking.', '[deleted]', ""lmao i quit all the scrolling video social medias like tiktok and yt a couple months back and it's the best""]","['If only there were some way to interact with people outside of social media. :(', 'You can talk to other people ouside of the internet you know its called real life.', ""Did you know that the people you talk to on the internet actually exist in real life? It's crazy but it's true."", ""People don't stop existing once they're off social media.  \nYou can still talk to them...!!"", 'Yes you would have to actually interact with them “IRL” as you people say.']",31,26,0.61,Musing,1749665826.0
1l82wnn,Showerthoughts,Baskets must have been really unreliable if serious advice in the past was to not put all your eggs into one basket.,,"['/u/Po1sonator has flaired this post as a **speculation**.\n\nSpeculations should prompt people to consider interesting premises that cannot be reliably verified or falsified.\n\nIf this post is poorly written, unoriginal, or rule-breaking, please report it.\n\nOtherwise, please add your comment to the discussion!\n\n&nbsp;\n\n^^This ^^is ^^an ^^automated ^^system.\n\n^^If ^^you ^^have ^^any ^^questions, ^^please [^^use ^^this ^^link](https://www.reddit.com/message/compose/?to=/r/Showerthoughts&subject=Question%20About%20This%20Post&message=I%20have%20a%20question%20regarding%20a%20recent%20post.I%20understand%20that%20I%20may%20be%20banned%20if%20my%20question%20has%20already%20been%20addressed%20by%20the%20rules.) ^^to ^^message ^^the ^^moderators.', 'Hearing this stuff always reminds me of a joke. \n\nThere was a man that rode his bike to the store to buy some liquor. He\'s about to leave the store, but starts to think about it.  \n\n""I had better go ahead and drink these incase I wreck and break my bottles.""\n\nWhen he arrives home his friend is there and ask him where the liquor is he went to buy.\n\n""Thank god I drank those before I left the store! I wrecked my bike 5 f*cking times on the way home!""', 'You are disregarding the fragility of eggs and entirely missing the point of the saying', 'You think the metaphor is *about the basket?*', 'And people must have been dumb AF if they genuinely needed to be told to not put the cart before the horse. Or ***MAYBE*** these are metaphors not to be taken literally.', ""its not about the basket, its about human error/unforeseen circumstances. The basket can be perfect, but if you drop it, you better hope you don't have all your eggs in it."", 'OP do you even know the meaning of this saying? It could be ""don\'t put all your eggs in one carton"" and the meaning would be the same. The basket has nothing to do with it.', 'Hasn’t the saying always been a metaphor? I don’t think there has ever been a literal interpretation of it. Just literally “don’t put all your wealth in one place”', 'Not the basket. But if you stumble and fall, all the eggs are scrambled.', ""Apparently, the saying is at least 400 years old.  I guess breaking \\*all\\* of the landowner's eggs would have been a pretty big deal.""]","['Hearing this stuff always reminds me of a joke. \n\nThere was a man that rode his bike to the store to buy some liquor. He\'s about to leave the store, but starts to think about it.  \n\n""I had better go ahead and drink these incase I wreck and break my bottles.""\n\nWhen he arrives home his friend is there and ask him where the liquor is he went to buy.\n\n""Thank god I drank those before I left the store! I wrecked my bike 5 f*cking times on the way home!""', 'You are disregarding the fragility of eggs and entirely missing the point of the saying', 'You think the metaphor is *about the basket?*', 'And people must have been dumb AF if they genuinely needed to be told to not put the cart before the horse. Or ***MAYBE*** these are metaphors not to be taken literally.', ""its not about the basket, its about human error/unforeseen circumstances. The basket can be perfect, but if you drop it, you better hope you don't have all your eggs in it.""]",2280,119,0.85,Speculation,1749572193.0
1l7uks2,Showerthoughts,The Strait of Messina is so wide that it makes any threat from Scylla and Charybdis practically non-existent.,,"['/u/bajadasaurus234 has flaired this post as a **speculation**.\n\nSpeculations should prompt people to consider interesting premises that cannot be reliably verified or falsified.\n\nIf this post is poorly written, unoriginal, or rule-breaking, please report it.\n\nOtherwise, please add your comment to the discussion!\n\n&nbsp;\n\n^^This ^^is ^^an ^^automated ^^system.\n\n^^If ^^you ^^have ^^any ^^questions, ^^please [^^use ^^this ^^link](https://www.reddit.com/message/compose/?to=/r/Showerthoughts&subject=Question%20About%20This%20Post&message=I%20have%20a%20question%20regarding%20a%20recent%20post.I%20understand%20that%20I%20may%20be%20banned%20if%20my%20question%20has%20already%20been%20addressed%20by%20the%20rules.) ^^to ^^message ^^the ^^moderators.', ""Tell me you don't know how currents work, without telling me you don't know how currents work.\n\nIt's not that they saw a safe strait and made up a dangerous story. They saw a dangerous strait and came up with an also dangerous story."", ""Guess it took Odysseus 20 years to realize he could've just swam across then!"", '[deleted]', ""The width varies throughout, and gets about 2 miles wide at its narrowest. We don't know how large the control of Charybdis was, or how rocky a narrow section might have been thousands of years ago. Between rocks and Charybdis on one side, it very well might have been impossible to cross without passing under Scylla.""]","[""Tell me you don't know how currents work, without telling me you don't know how currents work.\n\nIt's not that they saw a safe strait and made up a dangerous story. They saw a dangerous strait and came up with an also dangerous story."", ""Guess it took Odysseus 20 years to realize he could've just swam across then!"", '/u/bajadasaurus234 has flaired this post as a **speculation**.\n\nSpeculations should prompt people to consider interesting premises that cannot be reliably verified or falsified.\n\nIf this post is poorly written, unoriginal, or rule-breaking, please report it.\n\nOtherwise, please add your comment to the discussion!\n\n&nbsp;\n\n^^This ^^is ^^an ^^automated ^^system.\n\n^^If ^^you ^^have ^^any ^^questions, ^^please [^^use ^^this ^^link](https://www.reddit.com/message/compose/?to=/r/Showerthoughts&subject=Question%20About%20This%20Post&message=I%20have%20a%20question%20regarding%20a%20recent%20post.I%20understand%20that%20I%20may%20be%20banned%20if%20my%20question%20has%20already%20been%20addressed%20by%20the%20rules.) ^^to ^^message ^^the ^^moderators.', '[deleted]', ""The width varies throughout, and gets about 2 miles wide at its narrowest. We don't know how large the control of Charybdis was, or how rocky a narrow section might have been thousands of years ago. Between rocks and Charybdis on one side, it very well might have been impossible to cross without passing under Scylla.""]",10,15,0.57,Speculation,1749548695.0
