id,subreddit,title,selftext,comments,top_comments,score,num_comments,upvote_ratio,flair,created_utc
1lmr96l,Showerthoughts,"During your life you will walk by, drive by, sit near and occupy the same rooms with hundreds of thousands of people that you will never meet.",,"[""The moderators have reflaired this post as a **casual thought**.\n\nCasual thoughts should be presented well, but are not required to be unique or exceptional.\n\nPlease review [each flair's requirements](https://www.reddit.com/r/Showerthoughts/wiki/requirements) for more information.\n\n&nbsp;\n\n^^This ^^is ^^an ^^automated ^^system.\n\n^^If ^^you ^^have ^^any ^^questions, ^^please [^^use ^^this ^^link](https://www.reddit.com/message/compose/?to=/r/Showerthoughts&subject=Question%20About%20This%20Post&message=I%20have%20a%20question%20regarding%20a%20recent%20post.I%20understand%20that%20I%20may%20be%20banned%20if%20my%20question%20has%20already%20been%20addressed%20by%20the%20rules.) ^^to ^^message ^^the ^^moderators."", 'Sometimes you walk by, drive by, sit near and occupy the same rooms with people who you’ve met previously and who pretend like it’s a new interaction', 'I find myself occasionally thinking about the cameos I’ve made in other people’s lives - throwing their dropped mitts after them as the train door closes, moving aside to let them pass on the sidewalk. It feels surreal! Thanks for sharing this.', 'My super power wish has always been to be able to close my eyes and observe the lives of any person(s) that has ever existed and vicariously live their experiences. Not like a second for a second though, quicker, like second for an hour or a day, but still clear and informative.\n\nP.S. not a voyeur', '“I think about strangers in the shower” is basically this post. \n\nNot judging, just observing', 'In college, I was walking with a student I had recently met, and a passenger jet flew over us. She asked me something like, “Do you ever think about all the people on airplanes and their lives, and how you’ll never meet them?”\n\nI *had* thought about that a lot, but I hadn’t heard anyone else talk about it. Our meeting of the minds that day led to us dating for a couple of years.', 'Seems like one of those feelings where there’s no word in English but there probably is in Japanese:\n\n*The existisitential awareness of being a background character within the storylines of many whom you will never meet.*', 'From Sum: 40 Tales of the Afterlife\n\n\nWhen you die, you feel as though there were some subtle change, but everything looks approximately the same. You get up and brush your teeth. You kiss your spouse and kids and leave for the office. There is less traffic than normal. The rest of your building seems less full, as though it’s a holiday. But everyone in your office is here, and they greet you kindly. You feel strangely popular. Everyone you run into is someone you know. At some point, it dawns on you that this is the afterlife: the world is only made up of people you’ve met before.\n\nIt’s a small fraction of the world population\u200a—\u200aabout 0.00002 percent\u200a—\u200abut it seems like plenty to you.\n\nIt turns out that only the people you remember are here. So the woman with whom you shared a glance in the elevator may or may not be included. Your second-grade teacher is here, with most of the class. Your parents, your cousins, and your spectrum of friends through the years. All your old lovers. Your boss, your grandmothers, and the waitress who served your food each day at lunch. Those you dated, those you almost dated, those you longed for. It is a blissful opportunity to spend quality time with your one thousand connections, to renew fading ties, to catch up with those you let slip away.\n\nIt is only after several weeks of this that you begin to feel forlorn. You wonder what’s different as you saunter through the vast quiet parks with a friend or two. No strangers grace the empty park benches. No family unknown to you throws bread crumbs for the ducks and makes you smile because of their laughter.\n\nAs you step into the street, you note there are no crowds, no buildings teeming with workers, no distant cities bustling, no hospitals running 24/7 with patients dying and staff rushing, no trains howling into the night with sardined passengers on their way home. Very few foreigners. You begin to consider all the things unfamiliar to you. You’ve never known, you realize, how to vulcanize rubber to make a tire. And now those factories stand empty. You’ve never known how to fashion a silicon chip from beach sand, how to launch rockets out of the atmosphere, how to pit olives or lay railroad tracks. And now those industries are shut down.\n\nThe missing crowds make you lonely.You begin to complain about all the people you could be meeting. But no one listens or sympathizes with you, because this is precisely what you chose when you were alive.', 'and some that you will meet, but not for years.', 'Take a good look at the people getting off the bus n, you may never see them again.']","['Sometimes you walk by, drive by, sit near and occupy the same rooms with people who you’ve met previously and who pretend like it’s a new interaction', 'I find myself occasionally thinking about the cameos I’ve made in other people’s lives - throwing their dropped mitts after them as the train door closes, moving aside to let them pass on the sidewalk. It feels surreal! Thanks for sharing this.', 'My super power wish has always been to be able to close my eyes and observe the lives of any person(s) that has ever existed and vicariously live their experiences. Not like a second for a second though, quicker, like second for an hour or a day, but still clear and informative.\n\nP.S. not a voyeur', '“I think about strangers in the shower” is basically this post. \n\nNot judging, just observing', 'In college, I was walking with a student I had recently met, and a passenger jet flew over us. She asked me something like, “Do you ever think about all the people on airplanes and their lives, and how you’ll never meet them?”\n\nI *had* thought about that a lot, but I hadn’t heard anyone else talk about it. Our meeting of the minds that day led to us dating for a couple of years.']",1851,59,0.96,Casual Thought,1751128867.0
1lmlx8w,Showerthoughts,Sperm donation is human pollination.,,"[""The moderators have reflaired this post as a **casual thought**.\n\nCasual thoughts should be presented well, but are not required to be unique or exceptional.\n\nPlease review [each flair's requirements](https://www.reddit.com/r/Showerthoughts/wiki/requirements) for more information.\n\n&nbsp;\n\n^^This ^^is ^^an ^^automated ^^system.\n\n^^If ^^you ^^have ^^any ^^questions, ^^please [^^use ^^this ^^link](https://www.reddit.com/message/compose/?to=/r/Showerthoughts&subject=Question%20About%20This%20Post&message=I%20have%20a%20question%20regarding%20a%20recent%20post.I%20understand%20that%20I%20may%20be%20banned%20if%20my%20question%20has%20already%20been%20addressed%20by%20the%20rules.) ^^to ^^message ^^the ^^moderators."", 'Not really. Sex is human pollination as pollination is the process where pollen is transferred from the male part of a flower to the female part. \n\nSperm donation would only be the first half of pollination. Transferring from the male but not to the female yet.', 'Human pollination sounds cool until you realize he’s doing side quests without finishing the main storyline', ""I almost gave up fighting my compulsion to expose myself but I think I'll keep on sticking it out"", 'makes you wonder if sperm donors should start getting frequent-flier miles for their “pollination services.”\xa0', 'Loosely accurate way of explaining reproduction in not scientific words. Then the child would be the fruit of the pollination.', ""Ya missed a step. Plants do alternation of generation, pollen isn't sperm but is a miniature plant that produces sperm."", 'Public masturbation is more human pollination than sperm donation', '[deleted]', '*Donating sperm; pollination by a paintbrush*\n\nis an accurate analogy according to the sponge between my ear holes\n\nOne is *mimicking* the nasty and *increasing the numerous iterations* of insemination that would never/rarely occur in a natural setting']","['Not really. Sex is human pollination as pollination is the process where pollen is transferred from the male part of a flower to the female part. \n\nSperm donation would only be the first half of pollination. Transferring from the male but not to the female yet.', 'Human pollination sounds cool until you realize he’s doing side quests without finishing the main storyline', ""I almost gave up fighting my compulsion to expose myself but I think I'll keep on sticking it out"", 'makes you wonder if sperm donors should start getting frequent-flier miles for their “pollination services.”\xa0', 'Loosely accurate way of explaining reproduction in not scientific words. Then the child would be the fruit of the pollination.']",663,39,0.95,Casual Thought,1751114584.0
1lmivwe,Showerthoughts,"If puberty is confusing for humans, metamorphosis must be extremely confusing for caterpillars.",,"['/u/B0kke has flaired this post as a **musing**.\n\nMusings are expected to be high-quality and thought-provoking, but not necessarily as unique as [showerthoughts](https://www.reddit.com/r/Showerthoughts/wiki/requirements).\n\nIf this post is poorly written, unoriginal, or rule-breaking, please report it.\n\nOtherwise, please add your comment to the discussion!\n\n&nbsp;\n\n^^This ^^is ^^an ^^automated ^^system.\n\n^^If ^^you ^^have ^^any ^^questions, ^^please [^^use ^^this ^^link](https://www.reddit.com/message/compose/?to=/r/Showerthoughts&subject=Question%20About%20This%20Post&message=I%20have%20a%20question%20regarding%20a%20recent%20post.I%20understand%20that%20I%20may%20be%20banned%20if%20my%20question%20has%20already%20been%20addressed%20by%20the%20rules.) ^^to ^^message ^^the ^^moderators.', 'I doubt that they’re advanced enough for complex thought, but it still must be insane \n\nOn day you’re a worm-like thing with 6 legs and 4,000 muscles, then after shedding your skin a few times you realise that you need to spin yourself a shell. The next thing you know is that you need to break out of this shell, and enjoy the sunlight. Then all of a sudden YOU CAN FLY. You spent a couple of weeks completely restructuring yourself, and now you’re airborne \n\nMust be insane', 'While we do not know if caterpillars have the ability to self-reflect (unlikely) we DO know they remember experiences from before their metamorphosis. https://www.newscientist.com/article/dn13412-butterflies-remember-caterpillar-experiences/', '[removed]', ""I may be mistaken, but it's my understanding that the body basically dissolves itself into a soup before entirely reconstructing itself. \n\nPuberty wouldn't be confusing. It would be existentially terrifying."", ""Puberty is probably confusing for humans not necessarily cuz it's such an extreme change, but just cuz we can, like, think lol. A caterpillar probably just acts on instinct. A butterfly probably just acts on instinct. The instincts may be different, but I dunno if they can like look back and reflect on that fact"", 'When did caterpillars gain the ability to self reflection?', 'No big thing. One day I awoke to find I turned into a cockroach.', 'Puberty is confusing because adults keep teaching kids that ""puberty is a confusing time in your life"". I genuinely think that if that if we gave kids the facts of the physiology that takes place during puberty without making it awkward, and parents being better about building good relationships with their kids to have open dialogs over the kids\' evolving ideas about their identity, it would be fine.\n\nBut somehow we teach it it the most awkward way imaginable.\nYou say the word ""hormone"" to an 11 year old and they will giggle, thinking its sex related. Because the only time they\'ve ever heard that word so far is in their mediocre sex ed class where hormone means testosterone or estrogen exclusively and those are the ""sex hormones"". (Maybe thats not what the teacher said, but its all the kids hear, because, ""sex"")\n\nPhysiology isnt tought to kids at all, and its criminal.\nHormones range from making you feel sad, happy, sleepy, awake, hungry, full, everything.\nSome make you grow, some make your muscles get bigger, some make your joints relaxed.\n\nBut the entirety of elementary education skips super basic physio and jumps straight to ""during puberty hormones are out of balance, boys get more testosterone and girls get more estrogen, and you get hair in your pits and genitals""\n\n(Just to be clear too, when I say Physiology and hormones im clearly not referring at all to teaching kids under than 10-13 about having sex. Or anything related to the detailed structure of the genitalia. Literally just teach them about how the human body works at a basic level, where hormones control every person\'s, of every single age, entire existence)\n\nAlso, this is the easy part. \nUniversal good parenting to the point where a 15 year old boy or girl is willing to talk to both their parents about personal and social issues is probably never going to happen.\nI still see on reddit a teenager posting about how their parents take their doors away... WTF? Yeah... thats how you build a good relationship with a teenager', 'Write a book about it. Make it sad and the butterfly learns her friend she had a crush on was eaten by a parasitic wasp and watched the wasp hatch from the cryslisis']","['I doubt that they’re advanced enough for complex thought, but it still must be insane \n\nOn day you’re a worm-like thing with 6 legs and 4,000 muscles, then after shedding your skin a few times you realise that you need to spin yourself a shell. The next thing you know is that you need to break out of this shell, and enjoy the sunlight. Then all of a sudden YOU CAN FLY. You spent a couple of weeks completely restructuring yourself, and now you’re airborne \n\nMust be insane', 'While we do not know if caterpillars have the ability to self-reflect (unlikely) we DO know they remember experiences from before their metamorphosis. https://www.newscientist.com/article/dn13412-butterflies-remember-caterpillar-experiences/', '[removed]', ""Puberty is probably confusing for humans not necessarily cuz it's such an extreme change, but just cuz we can, like, think lol. A caterpillar probably just acts on instinct. A butterfly probably just acts on instinct. The instincts may be different, but I dunno if they can like look back and reflect on that fact"", ""I may be mistaken, but it's my understanding that the body basically dissolves itself into a soup before entirely reconstructing itself. \n\nPuberty wouldn't be confusing. It would be existentially terrifying.""]",11668,179,0.98,Musing,1751103657.0
1lmdudy,Showerthoughts,Generative AI would make it way easier for supernatural entities to hide their existence in an era of smartphones and social media.,,"[""The moderators have reflaired this post as a **speculation**.\n\nSpeculations should prompt people to consider original and interesting premises that cannot be reliably verified or falsified.\n\nPlease review [each flair's requirements](https://www.reddit.com/r/Showerthoughts/wiki/requirements) for more information.\n\n&nbsp;\n\n^^This ^^is ^^an ^^automated ^^system.\n\n^^If ^^you ^^have ^^any ^^questions, ^^please [^^use ^^this ^^link](https://www.reddit.com/message/compose/?to=/r/Showerthoughts&subject=Question%20About%20This%20Post&message=I%20have%20a%20question%20regarding%20a%20recent%20post.I%20understand%20that%20I%20may%20be%20banned%20if%20my%20question%20has%20already%20been%20addressed%20by%20the%20rules.) ^^to ^^message ^^the ^^moderators."", 'Honestly, ghost videos, UFO sightings, bigfoot, mothman, the lochness monster — all of those videos mean nothing now, never really thought about this.\xa0', 'CGI was a thing long ago. And if you want to make something polished today you still need manual made CGI with just little help of AI tools. \n\nAI here only make process faster and cheaper.', ""Not really. It's not as if Photoshop wasn't a thing"", 'I think the more interesting part is that we have lived through a tiny tiny tiny part of humanity where we could capture something in a photo or a video and it was considered evidence of a guaranteed reality, eg even if it didnt show the whole story we could assume it had happened. which led to photo editing like photoshop making them not trustworthy and now AI and deepfakes makes video no longer actual evidence of what happened.', '[deleted]', 'Hell, they could be researching their victims through cyber stalking, then choosing some online personality that would be easy to fudge the death date by manipulating their online presence\xa0', 'The machine god theory starts to make sense when you think like this.', 'Could you imagine if God just, like, slipped a selfie in somewhere?', 'Hey ChatGPT, create an AI demonic demon that upon getting angry, will destroy the entire world.']","['Honestly, ghost videos, UFO sightings, bigfoot, mothman, the lochness monster — all of those videos mean nothing now, never really thought about this.\xa0', 'CGI was a thing long ago. And if you want to make something polished today you still need manual made CGI with just little help of AI tools. \n\nAI here only make process faster and cheaper.', ""Not really. It's not as if Photoshop wasn't a thing"", 'I think the more interesting part is that we have lived through a tiny tiny tiny part of humanity where we could capture something in a photo or a video and it was considered evidence of a guaranteed reality, eg even if it didnt show the whole story we could assume it had happened. which led to photo editing like photoshop making them not trustworthy and now AI and deepfakes makes video no longer actual evidence of what happened.', ""The moderators have reflaired this post as a **speculation**.\n\nSpeculations should prompt people to consider original and interesting premises that cannot be reliably verified or falsified.\n\nPlease review [each flair's requirements](https://www.reddit.com/r/Showerthoughts/wiki/requirements) for more information.\n\n&nbsp;\n\n^^This ^^is ^^an ^^automated ^^system.\n\n^^If ^^you ^^have ^^any ^^questions, ^^please [^^use ^^this ^^link](https://www.reddit.com/message/compose/?to=/r/Showerthoughts&subject=Question%20About%20This%20Post&message=I%20have%20a%20question%20regarding%20a%20recent%20post.I%20understand%20that%20I%20may%20be%20banned%20if%20my%20question%20has%20already%20been%20addressed%20by%20the%20rules.) ^^to ^^message ^^the ^^moderators.""]",524,46,0.92,Speculation,1751084198.0
1lmdl3h,Showerthoughts,"Teenagers and adults finding each other gross is a feature, not a bug.",,"['/u/cimocw has flaired this post as a **casual thought**.\n\nCasual thoughts should be presented well, but may be less unique or less remarkable than [showerthoughts](https://www.reddit.com/r/Showerthoughts/wiki/requirements).\n\nIf this post is poorly written, unoriginal, or rule-breaking, please report it.\n\n Otherwise, please add your comment to the discussion!\n\n&nbsp;\n\n^^This ^^is ^^an ^^automated ^^system.\n\n^^If ^^you ^^have ^^any ^^questions, ^^please [^^use ^^this ^^link](https://www.reddit.com/message/compose/?to=/r/Showerthoughts&subject=Question%20About%20This%20Post&message=I%20have%20a%20question%20regarding%20a%20recent%20post.I%20understand%20that%20I%20may%20be%20banned%20if%20my%20question%20has%20already%20been%20addressed%20by%20the%20rules.) ^^to ^^message ^^the ^^moderators.', 'I forgot sex was a thing and I thought you meant just, like, conceptually and lemme tell you, I was confused as hell for a quick sec lmao', 'It’s not teenagers who are gross, it’s tweens. Nothing stinks like a sweaty 10 year old boy. Nothing. Adults aren’t gross, they just have sex which kids find well…gross lol.', ""I might be too autistic to understand this.  \n\nBut I'll bite.  \n\nwhy do you see any human in particular as gross?"", 'They do? Why then so many men are into teen girls? Porn with 18yos is quite popular as far as I know.', ""I think its talking about s*xualy. Like adults are supposed to be grossed out by teens and vice versa. Some adults think that its wrong to think like that and we're supposed to be attracted to each other which is Fkn Wild Man."", ""I don't really find either inherently gross. They're just different."", 'No shit. \n\neither you go out of the cave and hunt on your own, find your own mate or you die alone when your parents die. \n\nIts called teenage rebellion and its suppose to make sure you create your own personality instead of just copy paste your parents.', 'Except for most of history when people reproduced as soon as they were capable.\n\nThis is more cultural than a built in feature.', 'Wouldn’t it depends on what you mean by “gross”? \n\nGross as in not cool, that’s not good. Teenagers tend to make dumb mistakes because they refuse to take an adults advice.\n\nOn the other end, many teenagers have posters of adults on their walls.']","['I forgot sex was a thing and I thought you meant just, like, conceptually and lemme tell you, I was confused as hell for a quick sec lmao', 'It’s not teenagers who are gross, it’s tweens. Nothing stinks like a sweaty 10 year old boy. Nothing. Adults aren’t gross, they just have sex which kids find well…gross lol.', ""I might be too autistic to understand this.  \n\nBut I'll bite.  \n\nwhy do you see any human in particular as gross?"", 'They do? Why then so many men are into teen girls? Porn with 18yos is quite popular as far as I know.', ""I think its talking about s*xualy. Like adults are supposed to be grossed out by teens and vice versa. Some adults think that its wrong to think like that and we're supposed to be attracted to each other which is Fkn Wild Man.""]",6120,142,0.96,Casual Thought,1751083322.0
1llxde5,Showerthoughts,"Iridescent clothes are perceived as childish, but medieval royalty would kill to monopolize the right to wear them.",,"['/u/Linorelai has flaired this post as a **speculation**.\n\nSpeculations should prompt people to consider interesting premises that cannot be reliably verified or falsified.\n\nIf this post is poorly written, unoriginal, or rule-breaking, please report it.\n\nOtherwise, please add your comment to the discussion!\n\n&nbsp;\n\n^^This ^^is ^^an ^^automated ^^system.\n\n^^If ^^you ^^have ^^any ^^questions, ^^please [^^use ^^this ^^link](https://www.reddit.com/message/compose/?to=/r/Showerthoughts&subject=Question%20About%20This%20Post&message=I%20have%20a%20question%20regarding%20a%20recent%20post.I%20understand%20that%20I%20may%20be%20banned%20if%20my%20question%20has%20already%20been%20addressed%20by%20the%20rules.) ^^to ^^message ^^the ^^moderators.', 'I mean... I imagine the vast majority of ancient civilizations would love to monopolize almost anything modern.', ""As an adult I'm not letting anyone tell me whether I can wear iridescent clothes."", 'Plenty of adult formal or club wear is iridescent. Especially dresses.', 'Fun fact! They HAD iridescent fabric! \xa0It was done with the weave structure (twill or half-basket weave) and is more evident in realistic paintings of royalty from the 1700’s onward.\xa0\n\nThis has a decent explaination of how iridescence is made in weaving.\xa0\nhttps://handwovenmagazine.com/exploring-multicolor-iridescence/\n\nThis is an example of a silk fabric whose iridescence is made entirely through the weave structure:\xa0\nhttps://cdn.shopify.com/s/files/1/0558/3725/products/Iridescent_Silk_Dupioni_45_-_Fuchsia_Sea_Foam_2_1200x.jpg?v=1612468611', 'Honestly, if a medieval king saw a holographic jacket, he’d probably think you were some kind of sorcerer. It’s funny how something that would’ve screamed “power and wealth” back then now gets labeled as tacky or childish. Fashion really just loops in weird ways.', 'When something is cheap the rich pretend not to like it to seem fancy.\n\nSee also, food portions', 'I see many thousands of adults wearing iridescent clothes each year but very rarely see children wearing such.  Last week alone at Electric Forest I probably saw more than 5K adults shimmering in their outfits.', '[deleted]', '""Medieval kings would’ve traded their crowns for a pair of iridescent trackies!']","['I mean... I imagine the vast majority of ancient civilizations would love to monopolize almost anything modern.', ""As an adult I'm not letting anyone tell me whether I can wear iridescent clothes."", 'Plenty of adult formal or club wear is iridescent. Especially dresses.', 'Fun fact! They HAD iridescent fabric! \xa0It was done with the weave structure (twill or half-basket weave) and is more evident in realistic paintings of royalty from the 1700’s onward.\xa0\n\nThis has a decent explaination of how iridescence is made in weaving.\xa0\nhttps://handwovenmagazine.com/exploring-multicolor-iridescence/\n\nThis is an example of a silk fabric whose iridescence is made entirely through the weave structure:\xa0\nhttps://cdn.shopify.com/s/files/1/0558/3725/products/Iridescent_Silk_Dupioni_45_-_Fuchsia_Sea_Foam_2_1200x.jpg?v=1612468611', 'Honestly, if a medieval king saw a holographic jacket, he’d probably think you were some kind of sorcerer. It’s funny how something that would’ve screamed “power and wealth” back then now gets labeled as tacky or childish. Fashion really just loops in weird ways.']",1484,40,0.98,Speculation,1751039536.0
