id,subreddit,title,selftext,comments,top_comments,score,num_comments,upvote_ratio,flair,created_utc
1lshajc,Showerthoughts,More people have likely shouted “Three!” while jumping from a high place than any other number.,,"['/u/SavvyOri has flaired this post as a **speculation**.\n\nSpeculations should prompt people to consider interesting premises that cannot be reliably verified or falsified.\n\nIf this post is poorly written, unoriginal, or rule-breaking, please report it.\n\nOtherwise, please add your comment to the discussion!\n\n&nbsp;\n\n^^This ^^is ^^an ^^automated ^^system.\n\n^^If ^^you ^^have ^^any ^^questions, ^^please [^^use ^^this ^^link](https://www.reddit.com/message/compose/?to=/r/Showerthoughts&subject=Question%20About%20This%20Post&message=I%20have%20a%20question%20regarding%20a%20recent%20post.I%20understand%20that%20I%20may%20be%20banned%20if%20my%20question%20has%20already%20been%20addressed%20by%20the%20rules.) ^^to ^^message ^^the ^^moderators.', 'Poor Three, always the last thing humans say before regretting their decisions mid-air.', 'Three shall be the number thou shalt count, and the number of the counting shall be three. Four shalt thou not count, neither count thou two, excepting that thou then proceed to three. Five is right out.', 'You count up 1, 2, 3 instead of counting down??', 'We\'ve been studying these things called ""humans"" and apparently they have this ritual where they yell the word ""three"" really loud and then try and fall to their death. However for some reason they prefer it when the ritual fails and they don\'t die. Truly fascinating creatures.', 'I wonder if a significant amount of non-American cultures count forward more often', 'My family liked:\n\nOne for the money,\nTwo for the show,\nThree to get ready,\nAnd Four to go!', 'Yeah, most people aren’t using numbers when jumping from high places, it is usually more ahhhhhh!!!!!!!', 'But... Do we go on three, or like, 1, 2, 3, and then go?', 'Statistically speaking probably as much as ""One!"".']","['Poor Three, always the last thing humans say before regretting their decisions mid-air.', 'You count up 1, 2, 3 instead of counting down??', 'Three shall be the number thou shalt count, and the number of the counting shall be three. Four shalt thou not count, neither count thou two, excepting that thou then proceed to three. Five is right out.', 'We\'ve been studying these things called ""humans"" and apparently they have this ritual where they yell the word ""three"" really loud and then try and fall to their death. However for some reason they prefer it when the ritual fails and they don\'t die. Truly fascinating creatures.', 'I wonder if a significant amount of non-American cultures count forward more often']",1218,62,0.95,Speculation,1751741972.0
1lsgpqc,Showerthoughts,Analog clocks in phones are still fundamentally digital clocks.,,"['/u/256Moin256 has flaired this post as a **casual thought**.\n\nCasual thoughts should be presented well, but may be less unique or less remarkable than [showerthoughts](https://www.reddit.com/r/Showerthoughts/wiki/requirements).\n\nIf this post is poorly written, unoriginal, or rule-breaking, please report it.\n\nOtherwise, please add your comment to the discussion!\n\n&nbsp;\n\n^^This ^^is ^^an ^^automated ^^system.\n\n^^If ^^you ^^have ^^any ^^questions, ^^please [^^use ^^this ^^link](https://www.reddit.com/message/compose/?to=/r/Showerthoughts&subject=Question%20About%20This%20Post&message=I%20have%20a%20question%20regarding%20a%20recent%20post.I%20understand%20that%20I%20may%20be%20banned%20if%20my%20question%20has%20already%20been%20addressed%20by%20the%20rules.) ^^to ^^message ^^the ^^moderators.', '[deleted]', 'Not fundamentally. Actually.\n\nAn analog clock on a phone is only an image on a display.', 'All accurate clocks must be digital clocks, since they achieve accuracy by synchronizing to the atomic clock, which is based on quantum ""ticks"".\n\nYou could, I suppose, have a very accurate clepsydra that you synch to the atomic clock hourly, and that might be accurate enough but still analog. Probably wouldn\'t work on board a ship, though.', 'There has never been a more casual thought than this one.', '[deleted]', 'I would never trust a clock that is in disguise.', 'Not all people, especially younger ones, can read an analog clock.', 'Yet we still call them phones when making an actual call with them is like 1% of the usage.', ""They're digital in a different way though, which is interesting\n\nDigital clocks show time with digits\n\nAnalog clocks in phones show time with hands but the way they work used digits (at least conceptually)""]","['All accurate clocks must be digital clocks, since they achieve accuracy by synchronizing to the atomic clock, which is based on quantum ""ticks"".\n\nYou could, I suppose, have a very accurate clepsydra that you synch to the atomic clock hourly, and that might be accurate enough but still analog. Probably wouldn\'t work on board a ship, though.', '[deleted]', 'Not fundamentally. Actually.\n\nAn analog clock on a phone is only an image on a display.', 'There has never been a more casual thought than this one.', '/u/256Moin256 has flaired this post as a **casual thought**.\n\nCasual thoughts should be presented well, but may be less unique or less remarkable than [showerthoughts](https://www.reddit.com/r/Showerthoughts/wiki/requirements).\n\nIf this post is poorly written, unoriginal, or rule-breaking, please report it.\n\nOtherwise, please add your comment to the discussion!\n\n&nbsp;\n\n^^This ^^is ^^an ^^automated ^^system.\n\n^^If ^^you ^^have ^^any ^^questions, ^^please [^^use ^^this ^^link](https://www.reddit.com/message/compose/?to=/r/Showerthoughts&subject=Question%20About%20This%20Post&message=I%20have%20a%20question%20regarding%20a%20recent%20post.I%20understand%20that%20I%20may%20be%20banned%20if%20my%20question%20has%20already%20been%20addressed%20by%20the%20rules.) ^^to ^^message ^^the ^^moderators.']",130,17,0.86,Casual Thought,1751740448.0
1lsgiuy,Showerthoughts,The surest sign that you can't trust someone is them telling you that you can trust them.,,"[""The moderators have reflaired this post as a **casual thought**.\n\nCasual thoughts should be presented well, but are not required to be unique or exceptional.\n\nPlease review [each flair's requirements](https://www.reddit.com/r/Showerthoughts/wiki/requirements) for more information.\n\n&nbsp;\n\n^^This ^^is ^^an ^^automated ^^system.\n\n^^If ^^you ^^have ^^any ^^questions, ^^please [^^use ^^this ^^link](https://www.reddit.com/message/compose/?to=/r/Showerthoughts&subject=Question%20About%20This%20Post&message=I%20have%20a%20question%20regarding%20a%20recent%20post.I%20understand%20that%20I%20may%20be%20banned%20if%20my%20question%20has%20already%20been%20addressed%20by%20the%20rules.) ^^to ^^message ^^the ^^moderators."", ""Don't be so negative snakeravencat, Reddit is too full of negative waves already. Be optimistic. Here, I'll start us off: The most important human attribute is being honest, candid, and sincere. Once you learn how to fake all that the world is your oyster. Don't care for shellfish? Perhaps the world can be your bacon cheeseburger. As for me, the world is my wheat bread sandwich where I put butter on one slice and Grandma's Molasses on the other slice. YUM."", 'Unfortunately that logic just means when someone honestly says you can trust them, you don’t believe it. So you’ll not trust anyone', 'This seems to be true of most concepts like this. The least cool people are the ones that talk about how cool they (and often their family and/or SO) are.', 'When They have broken your trust 2-3 times. People make mistakes and can learn from them. But if they keep making the same mistake, or fail to recognize any error in the first place then you probably shouldn\'t trust them with anything major. \n\nHowever, reliability and trustworthiness are different things. Being reliable and being trustworthy usually have pretty good overlap for applicable cases. But being unreliable is different than being untrustworthy. Is this person failing to uphold their promises because they made an error, or are they failing to uphold their promises because they\'re being deceitful?\n\nThe main difference between these two cases are what they do next how you might react. If they\'re being deceitful then they will most likely continue being deceitful and you can conclude that they are untrustworthy. However this begs the question, how can you tell if they\'re being deceitful or not?\n\nIf they acknowledge their error, take responsibility for it and apologize, then you could consider giving them another chance to redeem themselves. At this point you should pay attention to how they learned from the mistakes they made and if they make a meaningful effort to change. If they actually try to improve and seek forgiveness then they are more likely unreliable rather than deceitful. This doesn\'t make them trustworthy yet, and you should expect them to provide consistent results before considering them reliable as well. However, this might help you distinguish dishonesty from simply human error. \n\nRemember Hanlon\'s razor: ""Never attribute to malice that which can be adequately explained by incompetence or stupidity""', ""And people who call you friend aren't friendly."", ""Yeah that's true for most things people who keep telling you their Christians are not Christians, they're basically trying to convince themselves not you."", ""It's even more true if someone tells you not to trust them. Especially if they're drunk."", '[deleted]', 'If you’re a thing (trustworthy, cool, etc.) you generally don’t need to tell people that you’re that thing, as they’ll just know it.']","[""Don't be so negative snakeravencat, Reddit is too full of negative waves already. Be optimistic. Here, I'll start us off: The most important human attribute is being honest, candid, and sincere. Once you learn how to fake all that the world is your oyster. Don't care for shellfish? Perhaps the world can be your bacon cheeseburger. As for me, the world is my wheat bread sandwich where I put butter on one slice and Grandma's Molasses on the other slice. YUM."", 'This seems to be true of most concepts like this. The least cool people are the ones that talk about how cool they (and often their family and/or SO) are.', 'Unfortunately that logic just means when someone honestly says you can trust them, you don’t believe it. So you’ll not trust anyone', ""And people who call you friend aren't friendly."", 'When They have broken your trust 2-3 times. People make mistakes and can learn from them. But if they keep making the same mistake, or fail to recognize any error in the first place then you probably shouldn\'t trust them with anything major. \n\nHowever, reliability and trustworthiness are different things. Being reliable and being trustworthy usually have pretty good overlap for applicable cases. But being unreliable is different than being untrustworthy. Is this person failing to uphold their promises because they made an error, or are they failing to uphold their promises because they\'re being deceitful?\n\nThe main difference between these two cases are what they do next how you might react. If they\'re being deceitful then they will most likely continue being deceitful and you can conclude that they are untrustworthy. However this begs the question, how can you tell if they\'re being deceitful or not?\n\nIf they acknowledge their error, take responsibility for it and apologize, then you could consider giving them another chance to redeem themselves. At this point you should pay attention to how they learned from the mistakes they made and if they make a meaningful effort to change. If they actually try to improve and seek forgiveness then they are more likely unreliable rather than deceitful. This doesn\'t make them trustworthy yet, and you should expect them to provide consistent results before considering them reliable as well. However, this might help you distinguish dishonesty from simply human error. \n\nRemember Hanlon\'s razor: ""Never attribute to malice that which can be adequately explained by incompetence or stupidity""']",251,19,0.86,Casual Thought,1751739965.0
1lsao1u,Showerthoughts,"If birds suddenly decided it was fun to poop on humans, there wouldn’t be much we could do about it.",,"[""The moderators have reflaired this post as a **casual thought**.\n\nCasual thoughts should be presented well, but are not required to be unique or exceptional.\n\nPlease review [each flair's requirements](https://www.reddit.com/r/Showerthoughts/wiki/requirements) for more information.\n\n&nbsp;\n\n^^This ^^is ^^an ^^automated ^^system.\n\n^^If ^^you ^^have ^^any ^^questions, ^^please [^^use ^^this ^^link](https://www.reddit.com/message/compose/?to=/r/Showerthoughts&subject=Question%20About%20This%20Post&message=I%20have%20a%20question%20regarding%20a%20recent%20post.I%20understand%20that%20I%20may%20be%20banned%20if%20my%20question%20has%20already%20been%20addressed%20by%20the%20rules.) ^^to ^^message ^^the ^^moderators."", 'If birds were smart enough to plan that, they’d be smart enough to know it’s basically suicide. \n\nHumans kill animals for fun, imagine if we had a reason.', 'Well we can stop them eventually, just not immediately i guess', 'I own birds, 7 of them specifically, and they have learned that it is fun to poop on me. They go out of their way to fly off whatever they were doing, land on me, poop, and go back to whatever they were doing.\nIt happens.', 'Perfect for shower thoughts. This would be a poop shower. I think umbrellas would become popular though.', 'The complete opposite, humans destroy entire species for much less', 'someone will invent a poop umbrella where it has like a wiper like in car but in umbrella form', 'I disagree with not much we could do about it. \nIn the US the birds would lose the war unlike in Australia.', 'We kinda do. You if you look up at big buildings you might see v shaped spikes on beams. \n\nThese discourage birds from being directly above humans.\n\n(The poop war has always been relevant comrade)', ""Never owned a parrot I can tell.\n\nIt's their favorite game.""]","['If birds were smart enough to plan that, they’d be smart enough to know it’s basically suicide. \n\nHumans kill animals for fun, imagine if we had a reason.', 'Well we can stop them eventually, just not immediately i guess', 'Perfect for shower thoughts. This would be a poop shower. I think umbrellas would become popular though.', 'I own birds, 7 of them specifically, and they have learned that it is fun to poop on me. They go out of their way to fly off whatever they were doing, land on me, poop, and go back to whatever they were doing.\nIt happens.', 'The complete opposite, humans destroy entire species for much less']",3178,329,0.94,Casual Thought,1751724374.0
1ls0ahi,Showerthoughts,People that are still lighting off large fireworks in residential areas past 11pm aren’t necessarily assholes.  But they are definitely bad at resource management and showmanship. All of these lingering fireworks should have been included in a much bigger and earlier grand finale.,,"['/u/TheKingInTheNorth has flaired this post as a **casual thought**.\n\nCasual thoughts should be presented well, but may be less unique or less remarkable than [showerthoughts](https://www.reddit.com/r/Showerthoughts/wiki/requirements).\n\nIf this post is poorly written, unoriginal, or rule-breaking, please report it.\n\nOtherwise, please add your comment to the discussion!\n\n&nbsp;\n\n^^This ^^is ^^an ^^automated ^^system.\n\n^^If ^^you ^^have ^^any ^^questions, ^^please [^^use ^^this ^^link](https://www.reddit.com/message/compose/?to=/r/Showerthoughts&subject=Question%20About%20This%20Post&message=I%20have%20a%20question%20regarding%20a%20recent%20post.I%20understand%20that%20I%20may%20be%20banned%20if%20my%20question%20has%20already%20been%20addressed%20by%20the%20rules.) ^^to ^^message ^^the ^^moderators.', 'Also, why are people setting them off during the day?', 'they can be bad at resource management AND an asshole', 'Well, they are, but the biggest ones are the people who do this for TWO WEEKS IN A ROW. F*** those people.', 'What is crazy to me is the size of some of these. I am in the middle of 5 acres of woods and just had my windows rattle. I just hope everything is green enough to not catch fire.', ""Definitely assholes, I don't think anyone has ever not been worried that some idiot might set a fire"", ""No, they're assholes, I got work in the morning\xa0"", 'You’d feel a lot differently if a group of your neighbors decided June 12th was Slipknot appreciation day and played Slipknot music on arena size speakers that shook your house from 2 pm-1 am.', ""No, they are assholes. I'll call it like I see it. Anything more than small fireworks should not be in residental neighborhoods. Especially in fire prone / dry areas."", 'About to mow my lawn at 7am to payback the late night parties']","[""No, they're assholes, I got work in the morning\xa0"", 'Also, why are people setting them off during the day?', 'Well, they are, but the biggest ones are the people who do this for TWO WEEKS IN A ROW. F*** those people.', ""No, they are assholes. I'll call it like I see it. Anything more than small fireworks should not be in residental neighborhoods. Especially in fire prone / dry areas."", ""Definitely assholes, I don't think anyone has ever not been worried that some idiot might set a fire""]",2411,218,0.84,Casual Thought,1751685392.0
1lr82o2,Showerthoughts,There are only a few places in the universe that produce oxygen and get bombarded by Jupiter-sized hydrogen clouds ejected by a local star.,,"['/u/ValidatingUsername has flaired this post as a **musing**.\n\nMusings are expected to be high-quality and thought-provoking, but not necessarily as unique as [showerthoughts](https://www.reddit.com/r/Showerthoughts/wiki/requirements).\n\nIf this post is poorly written, unoriginal, or rule-breaking, please report it.\n\nOtherwise, please add your comment to the discussion!\n\n&nbsp;\n\n^^This ^^is ^^an ^^automated ^^system.\n\n^^If ^^you ^^have ^^any ^^questions, ^^please [^^use ^^this ^^link](https://www.reddit.com/message/compose/?to=/r/Showerthoughts&subject=Question%20About%20This%20Post&message=I%20have%20a%20question%20regarding%20a%20recent%20post.I%20understand%20that%20I%20may%20be%20banned%20if%20my%20question%20has%20already%20been%20addressed%20by%20the%20rules.) ^^to ^^message ^^the ^^moderators.', 'Are you talking about the idea of a “hot water world “?\n\nIf so, I would agree that this is probably a rare type of planet.  But!\n\nAs another commenter pointed out, there are an estimated 10 to the 23rd power stars in the universe visible to our instruments.\n\nHot Water Worlds may be a minority among them but there are inevitably more than “ a few”.', 'Jupiter sized hydrogen clouds? Can someone help me understand what this post means', 'Nope. There is an infinite number as far as we know.', 'kinda beautiful, right? tiny pockets of oxygen just vibing while the universe throws chaos their way. it’s like life exists where it really shouldn’t and still thrives.', 'No technically there’s an infinite amount of them.', '[deleted]', 'OK, yeah, after rereading the whole thread, I agree with you. I must have misread something before.']","['Are you talking about the idea of a “hot water world “?\n\nIf so, I would agree that this is probably a rare type of planet.  But!\n\nAs another commenter pointed out, there are an estimated 10 to the 23rd power stars in the universe visible to our instruments.\n\nHot Water Worlds may be a minority among them but there are inevitably more than “ a few”.', 'Nope. There is an infinite number as far as we know.', 'Jupiter sized hydrogen clouds? Can someone help me understand what this post means', 'No technically there’s an infinite amount of them.', 'kinda beautiful, right? tiny pockets of oxygen just vibing while the universe throws chaos their way. it’s like life exists where it really shouldn’t and still thrives.']",1551,69,0.93,Musing,1751597678.0
1lr3mmm,Showerthoughts,"If you make a silly face at any random child in public, chances are pretty good they will do one back, right? I wonder how many adults would match your energy if you made a silly face at them. It would certainly make grocery shopping more entertaining.",,"[""The moderators have reflaired this post as a **casual thought**.\n\nCasual thoughts should be presented well, but are not required to be unique or exceptional.\n\nPlease review [each flair's requirements](https://www.reddit.com/r/Showerthoughts/wiki/requirements) for more information.\n\n&nbsp;\n\n^^This ^^is ^^an ^^automated ^^system.\n\n^^If ^^you ^^have ^^any ^^questions, ^^please [^^use ^^this ^^link](https://www.reddit.com/message/compose/?to=/r/Showerthoughts&subject=Question%20About%20This%20Post&message=I%20have%20a%20question%20regarding%20a%20recent%20post.I%20understand%20that%20I%20may%20be%20banned%20if%20my%20question%20has%20already%20been%20addressed%20by%20the%20rules.) ^^to ^^message ^^the ^^moderators."", 'Stick your tongue out at the next person that makes eye contact with you', ""I was once Christmas shopping for my kids.  They weren't around, but we were in a toy store.  The teenager behind the counter locked eyes with me, and raised a foam sword.  I struck a mock fencing stance with my umbrella.  We had a brief battle, because there can be only one (I was wearing a trench coat actually.) Good times."", 'Probably a lot of confusion, and as someone who works at a grocery store, probably a lot of anger as well', ""I don't think this counts, but today, I was at a coffee shop, and a group came in. It was obvious they were from some kind of group home. An obviously older woman 50's was with them. She saw me and started saying hi and waving like toddlers do. I just smiled back, said hi, and gave her a wave back before her attendants directed her to her table."", 'I tried this doing this in my 20s or 30s. I got  some joyful responses but lots of hostility. After the 5th or 6th ""I\'ll beat your fucking ass"" it stops being fun.', 'Mirroring still works on adults, just have to be trickier. Try making a wide eyed surprised face at someone and they will probably do it too. I used to do this mid conversation to my friends in my early 20s and they\'d be like ""why\'d you do that"" and I\'d ask ""why did you also?""', 'That depends on how old you are. If you are a child making faces at adults many will make faces back. The older you get the less likely it becomes until it reaches a critical point at which it begins to become more likely again, but in an entirely different way.', 'Tbh I’d probably take it as a fucking insult but I’ve not always lived in the friendliest neighborhoods lol.', ""I have a rule: if I notice a kid looking at me, I cross my eyes and stick my tongue out. I'm pretty sure if I did that to adults, I'd be in a lot more fights.""]","['Stick your tongue out at the next person that makes eye contact with you', 'Probably a lot of confusion, and as someone who works at a grocery store, probably a lot of anger as well', ""I was once Christmas shopping for my kids.  They weren't around, but we were in a toy store.  The teenager behind the counter locked eyes with me, and raised a foam sword.  I struck a mock fencing stance with my umbrella.  We had a brief battle, because there can be only one (I was wearing a trench coat actually.) Good times."", ""I don't think this counts, but today, I was at a coffee shop, and a group came in. It was obvious they were from some kind of group home. An obviously older woman 50's was with them. She saw me and started saying hi and waving like toddlers do. I just smiled back, said hi, and gave her a wave back before her attendants directed her to her table."", 'I tried this doing this in my 20s or 30s. I got  some joyful responses but lots of hostility. After the 5th or 6th ""I\'ll beat your fucking ass"" it stops being fun.']",3296,104,0.96,Casual Thought,1751584058.0
